{
  "id": "urn:vcc:formula:personal-loan-calculator",
  "slug": "personal-loan-calculator",
  "version": "1.0.0",
  "entrypoint": "src/tools/personal-loan/calc.ts#calcPersonalLoan",
  "inputSchemaDigest": {
    "algorithm": "sha-256",
    "value": "ecdc543ae5f6b5cde0054286ef0b6ac6cd5f6b7ddb32545210b7c3a6b4f2decf"
  },
  "outputSchemaDigest": {
    "algorithm": "sha-256",
    "value": "0aaa5412fc141147b65a91be1f51ccc0081378ccb38b6a26f37aa64971efa880"
  },
  "implementationDigest": {
    "algorithm": "sha-256",
    "value": "da31012c40330e7e21538e7dd57503b16e8a0839159e96137090cccc9910b171"
  },
  "testsDigest": {
    "algorithm": "sha-256",
    "value": "cd6a7138e9b143f6fd981b4ecd1231283fd565c998d3d653d8e402e14f078ff2"
  },
  "dependencies": [
    {
      "name": "zod",
      "version": "4.4.3"
    }
  ],
  "datasets": [],
  "sources": [],
  "numericProfile": "vcc-decimal-v1",
  "numericDictionary": {
    "inputs": {
      "principal": {
        "type": "money",
        "scale": 2,
        "unit": "USD"
      },
      "annualRatePct": {
        "type": "percent",
        "scale": 4,
        "unit": "%"
      },
      "termMonths": {
        "type": "duration",
        "scale": 0,
        "unit": "months"
      },
      "originationFeePct": {
        "type": "percent",
        "scale": 4,
        "unit": "%"
      }
    },
    "outputs": {
      "monthlyPayment": {
        "type": "money",
        "scale": 2,
        "unit": "USD"
      },
      "totalInterest": {
        "type": "money",
        "scale": 2,
        "unit": "USD"
      },
      "totalPaid": {
        "type": "money",
        "scale": 2,
        "unit": "USD"
      },
      "originationFee": {
        "type": "money",
        "scale": 2,
        "unit": "USD"
      },
      "nominalAprPct": {
        "type": "percent",
        "scale": 4,
        "unit": "%"
      },
      "effectiveAprPct": {
        "type": "percent",
        "scale": 4,
        "unit": "%"
      }
    }
  },
  "outputProjection": [
    "monthlyPayment",
    "totalInterest",
    "totalPaid",
    "originationFee",
    "nominalAprPct",
    "effectiveAprPct"
  ]
}